camp_title,camp_site,addr,latlong,location,style,tags,url
桃園復興_嘎色鬧露營區,嘎色鬧露營區,"桃園市復興區奎輝里8鄰嘎色鬧23號 (嘎色鬧產業道路)","N24.775135,E121.324630",北區,親子同樂,"水池 沙坑 昆蟲",https://www.facebook.com/gonadoun.darli/
桃園復興_夢想家園露營區,夢想家園露營區,桃園市復興區華陵里9鄰上巴陵85號,"N24.685414,E121.396810",北區,觀賞美景,"小溪 步道 風景區 遊客 美景 古道 山景",https://www.facebook.com/DreamHome297/
桃園復興_奎輝營地,奎輝營地,桃園市復興區奎輝里5鄰12號,"N24.788240,E121.331277",北區,親子同樂,"吹風機 雨棚 溜滑梯 水池 沙坑 步道 螢火蟲 蝦 山景",https://www.facebook.com/qehuy.camp/
桃園復興_山上陽光農場,山上陽光農場,桃園巿復興區三民里1鄰水管頭10-5號,"N24.824941,E121.349926",北區,親子同樂,"飲水機 雨棚 美景 銀河",http://sunshine3822741.pixnet.net/blog
桃園復興_山大王休閒農莊,山大王休閒農莊,桃園市復興區成福道路,"N24.810972,E121.358972",北區,親子同樂,"溜滑梯 沙坑 老街 遊客 桐花 景觀",https://www.facebook.com/Yawii.Hayuan/
桃園復興_巴陵仙境果園露營區,"巴陵仙境果園露營區 (紫薇星宿景觀露營區)",桃園市復興區華陵里巴陵202號,"N24.705611,E121.419250",北區,吃喝玩樂,"低海拔 蝦 雲海 景觀",http://starhome.okgo.tw/
桃園復興_庫司景觀露營區,庫司景觀露營區,桃園市復興區霞雲里,"N24.819722,E121.404472",北區,觀賞美景,"步道 景觀",https://www.facebook.com/Kusucamp/
"桃園復興_彩霞谷 fun 露營","彩霞谷 fun 露營","桃園市復興區霞雲里1鄰金暖13-1號 [桃112鄉道]","N24.813722,E121.379722",北區,觀賞美景,"飲水機 小溪 蝦 溪流 大景 銀河",https://www.facebook.com/Hola581018.com.tw/
桃園復興_微笑草地,微笑草地,桃園市復興區華陵里11鄰中心路156-17號,"N24.688472,E121.412056",北區,觀賞美景,"雨棚 溜滑梯 雲海 景觀",https://www.facebook.com/Smiling.lawn/
桃園復興_恩愛農場,恩愛農場,桃園市復興區華陵里巴陵143-1號,"N24.696528,E121.422056",北區,觀賞美景,"步道 遊客 櫻花 景觀 美景 大景 山景",http://conjugallove.okgo.tw/
桃園復興_木村的家露營區,"木村的家露營區 (木村の家)",桃園市復興區華陵里11鄰,"N24.688380,E121.411333",北區,觀賞美景,"雨棚 步道 遊客 櫻花 溪流 美景 古道 山景",https://www.facebook.com/yuminxmahong
桃園復興_木河谷營地,木河谷營地,桃園市復興區義盛里上宇內,"N24.791158,E121.388961",北區,吃喝玩樂,"不高 溪流",https://ioioipip603.wixsite.com/mwahko
桃園復興_松野農園,松野農園,桃園市復興區高義里7鄰色霧鬧10-16號,"N24.724861,E121.381917",北區,觀賞美景,"步道 風景區",https://www.facebook.com/pypy325/
桃園復興_桃源仙谷,桃源仙谷,桃園市復興區長興里8鄰上高遶5-1號,"N24.787694,E121.278583",北區,親子同樂,"水池 螢火蟲 昆蟲 桐花 溪流 美景",http://www.tysv.com.tw/
桃園復興_樂悠露營區,樂悠露營區,桃園市復興區奎輝里2鄰下奎輝3-1號,"N24.802416,E121.328166",北區,親子同樂,"飲水機 吹風機 水池 昆蟲 美景 山景",https://www.facebook.com/homeloveyou0803/
桃園復興_樂野露營區,"樂野露營區 (山蘇的故鄉)",桃園市復興區華陵里11鄰180-11號,"N24.694489,E121.404405",北區,吃喝玩樂,"小溪 蝦 溪流",https://www.facebook.com/leyecamp/
桃園復興_歡喜農場,歡喜農場,桃園市復興區華陵里中心路156-15號,"N24.689243,E121.412541",北區,觀賞美景,"昆蟲 老街 櫻花 高海拔 景觀 美景 山景",https://www.facebook.com/lalahappy3618
桃園復興_比固花園,比固花園,"桃園市復興區高義村 (高義部落)","N24.704480,E121.350559",北區,觀賞美景,"吹風機 步道 風景區 遊客 櫻花 景觀 山景",https://www.facebook.com/campingbegood
桃園復興_比該溪生態露營區,比該溪生態露營區,桃園市復興區華陵里9鄰89-1號,"N24.679130,E121.425994",北區,親子同樂,"昆蟲 蝦 山景",https://www.facebook.com/qyz8690o/
桃園復興_沄峰農場,沄峰農場,桃園市復興區華陵里10鄰巴陵143-22號,"N24.701306,E121.422250",北區,觀賞美景,景觀,https://www.facebook.com/yunfeng.tw/
桃園復興_泰雅秘境露營區,泰雅秘境露營區,桃園市復興區奎輝里下奎輝段,"N24.800085,E121.328079",北區,吃喝玩樂,蝦,https://www.facebook.com/Tayalheaven
桃園復興_海萍茶園露營地,"海萍茶園露營地 (阿真小吃店)",桃園市復興區華陵里10鄰123號,"N24.686361,E121.399528",北區,親子同樂,"飲水機 吹風機 雨棚 溜滑梯 玩具 昆蟲 風景區 景觀 美景",https://www.facebook.com/lizhen637573
桃園復興_溪口台露營區,溪口台露營區,桃園市復興區澤仁里溪口台188號,"N24.803122,E121.344161",北區,親子同樂,"水池 沙坑 玩具 蝦 景觀 山景",https://www.facebook.com/lesaciru
桃園復興_爺亨溫泉露營區,爺亨溫泉露營區,桃園市復興區三光里11鄰爺亨24號,"N24.675570,E121.375157",北區,親子同樂,"飲水機 雨棚 溜滑梯 水池 步道 風景區 補給 遊客",https://www.facebook.com/A955785558/
桃園復興_石秀灣五葉松營地,石秀灣五葉松營地,桃園市復興區長興里11鄰高遶坪19號,"N24.802194,E121.290333",北區,親子同樂,"水池 沙坑 步道 蝦",https://www.facebook.com/TaiwanPineCampground
桃園復興_芘雅尚露營區,芘雅尚露營區,桃園市復興區華陵里14鄰141-9號,"N24.685176,E121.413316",北區,觀賞美景,高海拔,https://www.facebook.com/biyashang/
桃園復興_花家果園露營區,花家果園露營區,桃園市復興區華陵里巴陵138-1號,"N24.700556,E121.423056",北區,觀賞美景,"昆蟲 老街 櫻花 高海拔 景觀 美景 山景",https://www.facebook.com/huasfamily/
桃園復興_薔薇谷露營區,"薔薇谷露營區 (御花園農莊附屬露營區)",桃園市復興區上巴陵卡拉道路,"N24.693833,E121.400889",北區,觀賞美景,"水池 小溪 遊客 溪流 高海拔 古道 山景",https://www.facebook.com/a033884360/
桃園復興_蘋果農莊,蘋果農莊,桃園市復興區高義里7鄰雪霧鬧10-20號,"N24.724936,E121.378665",北區,觀賞美景,"吹風機 溜滑梯 步道 昆蟲 低海拔 遊客 高海拔 景觀 美景 山景",https://www.facebook.com/applefarm66
桃園復興_蜻蜓露營區,蜻蜓露營區,桃園市復興區奎輝里7鄰嘎色鬧2號,"N24.778483,E121.325071",北區,親子同樂,"水池 沙坑 步道 溪流 山景",https://www.facebook.com/linhewai/
桃園復興_融奎霖休閒露營區,融奎霖休閒露營區,桃園市復興區霞雲里9鄰庫志13號,"N24.806797,E121.390884",北區,親子同樂,"飲水機 雨棚 游泳池 泳池 不高 釣魚",https://www.facebook.com/rongqueilin/
桃園復興_觀星營地,觀星營地,桃園市復興區華陵里巴陵143-7號,"N24.697278,E121.421333",北區,觀賞美景,"高海拔 美景",http://gs.okgo.tw/
桃園復興_觀雲景觀農莊,"觀雲景觀農莊 (曾媽媽的家)",桃園市復興區華陵里上巴陵中心路145-6號,"N24.695028,E121.425278",北區,吃喝玩樂,"蝦 遊客 雲海",http://guanyun.okgo.tw/
桃園復興_迷露谷露營區,"迷露谷露營區 (拉拉山迷露谷水蜜桃農場)",桃園市復興區華陵里10鄰145-13號,"N24.694306,E121.424583",北區,觀賞美景,"蝦 櫻花 雲海",https://www.facebook.com/Lalashanmilugu
桃園復興_那山。達雅賀,那山。達雅賀,桃園市復興區霞雲里2鄰志繼2號,"N24.821982,E121.382334",北區,親子同樂,"吹風機 玩具",https://www.facebook.com/Ngasal.Tayax/
桃園復興_錦泰農場營地,錦泰農場營地,桃園市復興區華陵里9鄰99號,"N24.686018,E121.397126",北區,觀賞美景,"吹風機 櫻花 雲海",http://jintai.okgo.tw/
桃園復興_鑫園馬告咖啡,"鑫園馬告咖啡 (鑫園農場)",桃園市復興區長興里6鄰中高遶1號,"N24.796398,E121.281993",北區,親子同樂,"飲水機 吹風機 沙坑 螢火蟲 遊客 桐花",http://qmonkeyq.pixnet.net/blog
桃園復興_長興山水靜露營區,長興山水靜露營區,桃園市復興區長興里17鄰54號,"N24.800952,E121.307976",北區,親子同樂,"吹風機 水池 沙坑 步道 不高 美景",https://www.facebook.com/csssj118
桃園復興_開心農莊,開心農莊,桃園市復興區華陵里10鄰143-13號,"N24.697861,E121.421806",北區,觀賞美景,"飲水機 吹風機 步道 螢火蟲 雲海 溪流 高海拔 景觀 美景 大景 山景",http://joyful.lalashan.tw/
桃園復興_阮爸咖啡園休閒營區,阮爸咖啡園休閒營區,桃園市復興區義盛里7鄰上宇內9-1號,"N24.786038,E121.393415",北區,觀賞美景,"雨棚 水池 步道 風景區 景觀 美景 山景",https://www.facebook.com/RuanBaKaFeiNongYuan/
桃園復興_雅比斯露營區,"雅比斯露營區 (Yabis)",桃園市復興區華陵里9鄰上巴陵69號,"N24.688713,E121.414193",北區,親子同樂,"雨棚 步道 老街 雲海",https://www.facebook.com/jabez0773/
桃園復興_雲河露營農場,雲河露營農場,桃園市復興區華陵里上巴陵中心路,"N24.697093,E121.424276",北區,親子同樂,步道,https://www.facebook.com/yunhecamp/
桃園復興_雲頂休閒露營區,雲頂休閒露營區,桃園市復興區華陵里中心路,"N24.699444,E121.423944",北區,觀賞美景,"步道 昆蟲 街上 蝦 遊客 櫻花 雲海 景觀 美景 大景 山景 海景",http://cloud.lalashan.tw/
桃園復興_霞雲溪遊記園區,"霞雲溪遊記園區 (霞雲溪遊記能量養生園區) (霞雲神木生態露營農場) (茂豐農場)",桃園市復興區霞雲里庫志道路60號,"N24.807111,E121.398278",北區,觀賞美景,"螢火蟲 溪流",http://maofon.okgo.tw/
"桃園復興_露薩 Lu Sa 休閒露營區","露薩 Lu Sa 休閒露營區",桃園市復興區三光里爺亨35-1號,"N24.669778,E121.386144",北區,觀賞美景,"游泳池 泳池 沙坑 步道 玩具 不高 櫻花 雲海 山景",https://www.facebook.com/Lusa122161608/
桃園復興_飛督努露營區,飛督努露營區,桃園市復興區霞雲里5鄰佳志20-1號,"N24.842194,E121.401611",北區,親子同樂,水池,https://www.facebook.com/feidunu/
桃園復興_飛鼠不渴露營農場,飛鼠不渴露營農場,桃園市復興區高義里雪霧鬧,"N24.738378,E121.361036",北區,親子同樂,"溜滑梯 游泳池 泳池 沙坑 蝦 景觀",https://www.facebook.com/ice.taiyal/
桃園楊梅_埔心牧場,埔心牧場,桃園市楊梅區高榮里13鄰3-1號,"N24.925639,E121.175944",北區,親子同樂,"吹風機 遊客",https://www.pushin-ranch.com/
桃園楊梅_耀輝休閒牧場,耀輝休閒牧場,桃園市楊梅區瑞原里12鄰91-4號,"N24.917194,E121.123528",北區,親子同樂,"雨棚 溜滑梯 補給",http://hj47580.myweb.hinet.net/
桃園楊梅_驛品香生態農園,驛品香生態農園,桃園市楊梅區永寧里校前路1150號,"N24.883528,E121.152167",北區,親子同樂,"螢火蟲 昆蟲 蝦 桐花",http://www.butterfly.idv.tw/
桃園龍潭_快樂農場,快樂農場,桃園市龍潭區上華里溝東48-11號,"N24.847889,E121.218389",北區,親子同樂,"雨棚 游泳池 泳池 步道 蝦 遊客",http://happy-farm.myweb.hinet.net/
桃園龍潭_貓頭鷹的家,"貓頭鷹的家 (貓頭鷹露營區)","桃園市龍潭區三坑里永福路263巷口 (近三坑老街)","N24.843479,E121.250650",北區,吃喝玩樂,"沙坑 螢火蟲 老街 低海拔 美景",https://www.facebook.com/owlcampingtw/
花蓮吉安_碁園露營區,碁園露營區,花蓮縣吉安鄉中山路三段953巷53-2號,"N23.984393,E121.546459",東區,親子同樂,步道,https://www.facebook.com/camping1229/
花蓮壽豐_慢活趣露營,慢活趣露營,花蓮縣壽豐鄉共和村三農場10號旁,"N23.857258,E121.505397",東區,吃喝玩樂,"吹風機 水池 步道 補給 釣魚 蝦 遊客 雲海 美景 山景",https://www.facebook.com/line0925736360/
花蓮壽豐_海揚農莊,海揚農莊,"花蓮縣壽豐鄉溪口村廣玄1-1號 (溪口國小後方)","N23.822556,E121.472667",東區,親子同樂,"吹風機 泳池 近市區 古道 海景",https://hiyoungbnb.com/
花蓮壽豐_牛山呼庭休閒園區,牛山呼庭休閒園區,"花蓮縣壽豐鄉水璉村牛山39-5號 ([省11] 26.4K 處)","N23.763500,E121.569222",東區,吃喝玩樂,蝦,https://www.facebook.com/hutingvalas/
花蓮富里_台九線無毒農莊,台九線無毒農莊,"花蓮縣富里鄉羅山村 (羅山有機村)","N23.178227,E121.290157",東區,吃喝玩樂,風景區,https://www.facebook.com/no9food/
花蓮富里_彭大媽客家食堂民宿,彭大媽客家食堂民宿,花蓮縣富里鄉竹田村25鄰雲閩36號,"N23.218361,E121.314694",東區,觀賞美景,"雨棚 水池 景觀 美景",http://dama.hlbnb.net/index.htm
花蓮富里_春明農莊,春明農莊,花蓮縣富里鄉竹田村25鄰雲閩27號,"N23.222861,E121.310306",東區,吃喝玩樂,"步道 遊客",http://www.5657.com.tw/60cm/
花蓮富里_羅山露營區,"羅山露營區 (羅山有機生態教育園區) (星光露營區)","花蓮縣富里鄉羅山村東湖37號 (羅山有機村)","N23.201582,E121.276409",東區,親子同樂,"飲水機 風景區",https://www.facebook.com/luoshancamp/
花蓮新城_海悅灣休閒渡假民宿,海悅灣休閒渡假民宿,花蓮縣新城鄉北三棧122-6號,"N24.105017,E121.626187",東區,親子同樂,"飲水機 沙坑",https://www.facebook.com/haiyuewan/
花蓮新城_海憩露營區,海憩露營區,花蓮縣新城鄉順安村,"N24.109330,E121.628701",東區,親子同樂,"沙坑 玩具 螢火蟲 不高 溪流 景觀",https://www.facebook.com/OceanChill/
花蓮玉里_東湖生態農埸,"東湖生態農埸 (開心谷露營區) (開心谷滑草場)",花蓮縣玉里鎮東豐里竹林17-1號,"N23.364500,E121.358917",東區,吃喝玩樂,釣魚,https://2016elake.blogspot.tw/
花蓮玉里_林家園,林家園,花蓮縣玉里鎮觀音里14鄰高寮282號,"N23.380028,E121.389222",東區,親子同樂,昆蟲,https://www.facebook.com/LinFamilyGarden/
花蓮玉里_汪家古厝,汪家古厝,花蓮縣玉里鎮觀音里高寮277號,"N23.382361,E121.390056",東區,觀賞美景,"水池 遊客 美景",http://wanghouse277.blogspot.tw/
花蓮玉里_赤柯山小瑞士農場,赤柯山小瑞士農場,花蓮縣玉里鎮觀音里14鄰高寮275號,"N23.394528,E121.396000",東區,觀賞美景,"美景 山景",http://038851908.tw.tranews.com/
花蓮玉里_赤柯山嵐露營民宿,赤柯山嵐露營民宿,花蓮縣玉里鎮觀音里高寮239號,"N23.383111,E121.374963",東區,觀賞美景,"遊客 景觀 美景 銀河 海景",http://a0928877617.hualien-travel.com.tw/
花蓮瑞穗_原鄉溫泉民宿,原鄉溫泉民宿,花蓮縣瑞穗鄉瑞祥村5鄰五福路325號,"N23.496361,E121.357250",東區,吃喝玩樂,"吹風機 昆蟲 蝦 遊客",https://www.facebook.com/yuanhhs/
花蓮瑞穗_東岡秀川溫泉民宿,"東岡秀川溫泉民宿 (湧泉休閒牧場)",花蓮縣瑞穗鄉溫泉路三段2巷31-6號,"N23.488000,E121.353000",東區,親子同樂,步道,http://www.higashi.com.tw/
花蓮瑞穗_瑞峰溫泉民宿,瑞峰溫泉民宿,花蓮縣瑞穗鄉溫泉路3段2巷36-1號,"N23.491256,E121.350876",東區,吃喝玩樂,"吹風機 昆蟲 蝦 遊客",http://ruifeng.970bnb.net/
花蓮瑞穗_瑞穗露營區,"瑞穗露營區 (秀姑巒溪泛舟中心露營區)",花蓮縣瑞穗鄉中山路三段215號,"N23.488889,E121.400333",東區,親子同樂,"溜滑梯 遊客 山景",https://www.facebook.com/RUISUICAMPSITE/
花蓮瑞穗_藍月亮露營區,"藍月亮露營區 (鳳梨露營區)",花蓮縣瑞穗鄉富興村東興路143-8號,"N23.582546,E121.386351",東區,吃喝玩樂,"風景區 遊客 景觀 美景",http://www.fs261.com.tw/
花蓮秀林_奇蹟野戰營,"奇蹟野戰營 (奇蹟露營農場)","花蓮縣秀林鄉景美村加灣141號 (景美火車站附近)","N24.088068,E121.607705",東區,觀賞美景,"步道 風景區 補給 蝦 遊客 溪流 景觀 美景 古道 山景",https://www.facebook.com/Challenge.Camping/
花蓮秀林_山水間露營區,山水間露營區,"花蓮縣秀林鄉秀林村民有50-5號 (新城天主堂附近)","N24.130350,E121.650266",東區,觀賞美景,美景,http://camp-food.weebly.com/
花蓮秀林_西寶國小,西寶國小,花蓮縣秀林鄉富世村西寶11號,"N24.206861,E121.482833",東區,吃喝玩樂,"吹風機 雨棚 步道 蝦 遊客 櫻花",http://www.spps.hlc.edu.tw/
"花蓮豐濱_海浪 Cafe 露營區","海浪 Cafe 露營區 (那ㄜ哩岸海浪 Cafe) (海浪咖啡)",花蓮縣豐濱鄉立德73-1號,"N23.539306,E121.507194",東區,觀賞美景,"美景 海景",https://www.facebook.com/tapalik/
花蓮豐濱_石梯坪露營區,石梯坪露營區,花蓮縣豐濱鄉港口村石梯坪52號,"N23.485111,E121.511500",東區,觀賞美景,"美景 海景",http://camping33.pgo.tw/
花蓮鳳林_賽斯村,"賽斯村 (鳳凰山莊)",花蓮縣鳳林鎮鳳凰路300號,"N23.756639,E121.430167",東區,親子同樂,"游泳池 泳池 步道 遊客 美景",https://www.seth.org.tw/sethvillage/
苗栗三灣_侑橘休閒農園,侑橘休閒農園,苗栗縣三灣鄉永和村8鄰北坑12-1號,"N24.649278,E120.936000",中區,親子同樂,玩具,http://www.sunoranges.com/
苗栗三灣_小份美營地,小份美營地,苗栗縣三灣鄉內灣村小份美20-1號,"N24.669896,E120.950819",中區,親子同樂,"雨棚 水池 沙坑 街上",https://www.facebook.com/beautifulpieceofland
苗栗三灣_棕櫚灣,"棕櫚灣 (幃爾特三灣營地)",苗栗縣三灣鄉小北埔27號,"N24.644468,E120.965620",中區,親子同樂,"吹風機 沙坑 步道 昆蟲 遊客 山景",https://www.facebook.com/palmcoveliu
苗栗三灣_棠春休閒莊園,棠春休閒莊園,苗栗縣三灣鄉頂寮村4鄰竹湖15-1號,"N24.652837,E121.002422",中區,親子同樂,"水池 老街",https://www.facebook.com/TangChunCamping/
苗栗三灣_神農渡假農場,神農渡假農場,苗栗縣三灣鄉內灣村小份美12號,"N24.672139,E120.952389",中區,親子同樂,"溜滑梯 低海拔 景觀",https://www.facebook.com/STK0857/
苗栗三灣_童趣露營區,童趣露營區,苗栗縣三灣鄉大河村2鄰三洽坑14號,"N24.600879,E120.956872",中區,親子同樂,"吹風機 溜滑梯",https://www.facebook.com/CDK091/
苗栗三灣_逗點露營區,逗點露營區,苗栗縣三灣鄉內灣村龍峎頂5-17號,"N24.667680,E120.958502",中區,親子同樂,"飲水機 吹風機 雨棚 溜滑梯 水池 沙坑 低海拔",http://www.comma-camp.com.tw/
苗栗三灣_鄉町露營區,鄉町露營區,苗栗縣三灣鄉銅鏡村大銅鑼圈88號,"N24.668563,E120.980563",中區,親子同樂,"溜滑梯 水池",https://www.shiangting.com/
苗栗三義_不遠露營度假山莊,"不遠露營度假山莊 (不遠山莊)",苗栗縣三義鄉雙潭村9鄰雙連潭199號,"N24.395667,E120.785583",中區,吃喝玩樂,"水池 玩具 昆蟲 風景區 補給 蝦 景觀",http://www.close-2.com/
苗栗三義_五福山莊,五福山莊,苗栗縣三義鄉龍騰村12鄰草排40號,"N24.372503,E120.789999",中區,觀賞美景,美景,http://www.5fu.tw/index.html
苗栗三義_依杉林露營區,依杉林露營區,苗栗縣三義鄉雙潭村8鄰雙連潭102號,"N24.409192,E120.778468",中區,親子同樂,"飲水機 雨棚 玩具 雲海",http://130camp.blogspot.tw/
苗栗三義_半月彎露營區,半月彎露營區,苗栗縣三義鄉雙潭村崩山下80-6號,"N24.388333,E120.809833",中區,親子同樂,"昆蟲 街上 雲海",http://www.halfmoonbent.com.tw/
苗栗三義_山板樵休閒農場,"山板樵休閒農場 (楓橋夜泊露營場)",苗栗縣三義鄉雙連潭138號,"N24.402222,E120.794639",中區,吃喝玩樂,"步道 老街 坑道",https://www.facebook.com/shanbangiao/
苗栗三義_彩園親子露營區,彩園親子露營區,苗栗縣三義鄉雙潭村15鄰崩山下16號,"N24.383889 ,E120.805056",中區,親子同樂,"飲水機 景觀",http://www.cypccamp.com.tw/
苗栗三義_石濤園山莊,石濤園山莊,苗栗縣三義鄉雙潭村12鄰石崀28-1號,"N24.395417,E120.805167",中區,觀賞美景,"螢火蟲 桐花 美景",http://www.shitao.com.tw/
苗栗三義_貝岩居農場,貝岩居農場,苗栗縣三義鄉龍騰村13鄰龍騰3號,"N24.376751,E120.777471",中區,吃喝玩樂,"步道 蝦 遊客",https://www.facebook.com/BeiYanJu/
苗栗三義_遇見李白露營區,遇見李白露營區,苗栗縣三義鄉雙潭村130縣道大通公路,"N24.387578,E120.812607",中區,親子同樂,吹風機,https://www.facebook.com/libaicamp/
苗栗三義_錦繡山河露營區,錦繡山河露營區,苗栗縣三義鄉雙潭村崩山下,"N24.383961,E120.804373",中區,吃喝玩樂,"螢火蟲 蝦 桐花",https://www.facebook.com/JK20160921
苗栗三義_鐵道驛站露營區,鐵道驛站露營區,"苗栗縣三義鄉龍騰村外庄20號 (近龍騰斷橋)","N24.360389,E120.774472",中區,觀賞美景,"沙坑 步道 補給 遊客 櫻花 美景",https://www.facebook.com/LoveInRailwayinn
苗栗三義_雲想家露營區,雲想家露營區,苗栗縣三義鄉雙潭村15鄰崩山下36-8號,"N24.386967,E120.805929",中區,親子同樂,"沙坑 步道 玩具 不高 山景",http://www.queenyscottages.com/
"苗栗公館_山水 518 露營區","山水 518 露營區",苗栗縣公館鄉開礦村2鄰開礦26-25號,"N24.455056,E120.850111",中區,親子同樂,"雨棚 不高 美景",http://blog.xuite.net/jy6011/twblog
苗栗公館_戀戀山水農莊,戀戀山水農莊,苗栗縣公館鄉開礦村2鄰30號,"N24.463000,E120.845278",中區,親子同樂,"溜滑梯 水池 沙坑",http://www.inlove.com.tw/
苗栗公館_拍片場露營地,拍片場露營地,苗栗縣公館鄉開礦26-26號,"N24.453536,E120.849107",中區,觀賞美景,"螢火蟲 低海拔 釣魚 景觀 美景 大景",http://www.camping5261.com/
苗栗公館_樹語星晴露營區,樹語星晴露營區,苗栗縣公館鄉福星村,"N24.486481,E120.838244",中區,親子同樂,"吹風機 雨棚 溜滑梯 沙坑 蝦 溪流 高海拔 銀河 山景",https://www.facebook.com/AllanShen888/
苗栗公館_築夢農莊,築夢農莊,苗栗縣公館鄉福星村43-2號,"N24.485147,E120.822137",中區,觀賞美景,"沙坑 步道 老街 櫻花 雲海 溪流 高海拔 景觀 美景 山景",http://www.unds.com.tw/dream/
苗栗公館_綠野神農休閒民宿露營區,綠野神農休閒民宿露營區,"苗栗縣公館鄉仁安村9鄰122-28號 (茶園坪)","N24.514722,E120.845500",中區,親子同樂,"雨棚 溜滑梯 沙坑 古道",https://www.facebook.com/GreenShennong2014/
苗栗公館_芳樺園,芳樺園,"苗栗縣公館鄉開礦村142-10號 (位於苗栗開礦國小附近)","N24.461281,E120.865782",中區,親子同樂,"沙坑 玩具 昆蟲 蝦 楓葉 溪流 山景",https://www.facebook.com/yuco.a222
苗栗公館_衝到山上去放空,衝到山上去放空,苗栗縣公館鄉福星村福星227-3號,"N24.484014,E120.838409",中區,親子同樂,沙坑,https://www.facebook.com/go2mountain/
苗栗公館_跳跳城堡,跳跳城堡,苗栗縣公館鄉福星村,"N24.483618,E120.839339",中區,親子同樂,"沙坑 螢火蟲 不高 大景",https://www.facebook.com/dreamcastel888/
苗栗公館_金滿山露營山莊,金滿山露營山莊,苗栗縣公館鄉仁安村仁安219-1號附近,"N24.504684,E120.857048",中區,親子同樂,"飲水機 雨棚 水池 沙坑 釣魚 景觀",http://haapygo105.pixnet.net/blog
苗栗公館_銃庫營地,銃庫營地,苗栗縣公館鄉北河村17鄰165-2號,"N24.519876,E120.885475",中區,親子同樂,"飲水機 吹風機 水池 沙坑 蝦 雲海 景觀 古道",https://www.facebook.com/chunku.com.tw
苗栗公館_開礦露營區,開礦露營區,苗栗縣公館鄉開礦村,"N24.456038,E120.848419",中區,觀賞美景,"螢火蟲 低海拔 釣魚 景觀 美景 大景",https://www.facebook.com/kkcamping/
"苗栗卓蘭_1961 的星空露營區","1961 的星空露營區",苗栗縣卓蘭鎮西坪里27-1號,"N24.326279,E120.834457",中區,觀賞美景,"吹風機 步道 櫻花 美景 古道",https://www.facebook.com/1961stars/
苗栗卓蘭_代觀山農場露營區,代觀山農場露營區,苗栗縣卓蘭鎮景山里9鄰景山119-3號,"N24.352201,E120.848301",中區,親子同樂,"飲水機 吹風機",https://www.facebook.com/daiguanshan.1962/
苗栗卓蘭_兩朵雲露營區,兩朵雲露營區,苗栗縣卓蘭鎮西坪里,"N24.336061,E120.803992",中區,親子同樂,"飲水機 吹風機 雨棚 溜滑梯 水池 沙坑 玩具 街上 近市區 補給 景觀",https://www.facebook.com/2.Clouds.wonderland/
苗栗卓蘭_大草皮營區,"大草皮營區 (水玉妮光+ A 區)","苗栗縣卓蘭鎮西坪里109-21號 (17 號草堂旁)","N24.332444,E120.817577",中區,親子同樂,"吹風機 溜滑梯 沙坑",https://www.facebook.com/xiping20171010/
苗栗卓蘭_小森時光農場,小森時光農場,苗栗縣卓蘭鎮西坪里,"N24.324778,E120.847389",中區,親子同樂,"雨棚 釣魚",https://www.facebook.com/jeandon1216/
苗栗卓蘭_山林野地露營區,山林野地露營區,苗栗縣卓蘭鎮西坪里109-21號,"N24.332448,E120.817208",中區,親子同樂,"溜滑梯 沙坑 昆蟲",https://www.xiping.tw/
苗栗卓蘭_山林鳥日子,山林鳥日子,苗栗縣卓蘭鎮西坪里西坪73號,"N24.337694,E120.828194",中區,觀賞美景,"吹風機 螢火蟲 昆蟲 蝦 高海拔 景觀 面湖",https://www.facebook.com/30birdz
苗栗卓蘭_怡心園歡樂露營區,"怡心園歡樂露營區 (怡心園笑露營區) (怡心園休閒農場)",苗栗縣卓蘭鎮西坪里43-6號,"N24.332861,E120.831250",中區,吃喝玩樂,"吹風機 低海拔 補給 蝦",https://www.facebook.com/gogoecu/
苗栗卓蘭_悄悄話露營區,"悄悄話露營區 (水玉妮光+ B1 區)","苗栗縣卓蘭鎮西坪里 (17 號草堂附近)","N24.332519,E120.819809",中區,親子同樂,"吹風機 沙坑 蝦",https://www.facebook.com/missglin201604/
苗栗卓蘭_東耕露營地,東耕露營地,苗栗縣卓蘭鎮西坪里9鄰109-37號,"N24.332308,E120.815626",中區,吃喝玩樂,"不高 補給 蝦 景觀",https://www.facebook.com/donggengcamping/
